{
  "kind": "planning-integration-receipt/v1",
  "id": "issue-2926-2928-planning-repairs-archive-owner",
  "proposal_ref": ".agentic-workspace/planning/integration-proposals/issue-2926-2928-planning-repairs-archive-owner.integration-proposal.json",
  "outcome": "integrated",
  "requested_transition": "archive-owner",
  "owner": {
    "id": "issue-2926-2928-planning-repairs",
    "ref": ".agentic-workspace/planning/execplans/issue-2926-2928-planning-repairs.plan.json"
  },
  "external_ref": "",
  "proof_refs": [
    ".agentic-workspace/verification/proof-decision.json"
  ],
  "parent_boundary": "parent and lane remain open unless an independent boundary is satisfied",
  "preserved_invariants": [
    "feature branch does not select current work",
    "feature branch does not rewrite aggregate Planning indexes",
    "feature branch does not close parent/lane lifecycle truth",
    "integration apply is target-branch authoritative"
  ],
  "changed_fields": [
    "integration_proposal.status",
    "integration_proposal.phase",
    "owner.relationships.integration",
    "owner.lifecycle",
    "owner.phase",
    "owner.revision",
    "owner.active_milestone.status",
    "owner.proof_report",
    "parent_lane.child_contribution",
    "integration_receipt"
  ],
  "revisions": {
    "expected_subject": "d3c5bce44224fac7",
    "subject_before": "d3c5bce44224fac7",
    "subject_after": "aaa89b1b42a84aa8",
    "proposal_before": "5697a327695e203b",
    "proposal_after": "0822bcb298423d9c",
    "expected_planning_revision": "fa16773f61512bc8",
    "target_authority_before": "fa16773f61512bc8",
    "target_authority_after": "01b69224ca415474"
  },
  "authority_boundary": {
    "integrated_truth": "this receipt",
    "proposal_status": "proposal marked integrated by the same transaction",
    "owner_body": "updated by this transaction",
    "aggregate_indexes": "derived-regenerated-not-mutated",
    "branch_admission": {
      "status": "inside-git",
      "branch": "master",
      "phase": "target"
    }
  },
  "created_at": "2026-09-01T21:24:52.510657Z",
  "receipt_revision": "6fbb17d096e2b38e"
}
