{
  "kind": "planning-integration-receipt/v1",
  "id": "issue-2257-skill-dependency-closure-mark-integrated",
  "proposal_ref": ".agentic-workspace/planning/integration-proposals/issue-2257-skill-dependency-closure-mark-integrated.integration-proposal.json",
  "outcome": "integrated",
  "requested_transition": "mark-integrated",
  "owner": {
    "id": "issue-2257-skill-dependency-closure",
    "ref": ".agentic-workspace/planning/execplans/issue-2257-skill-dependency-closure.plan.json"
  },
  "external_ref": "",
  "proof_refs": [],
  "parent_boundary": "parent and lane remain open unless an independent boundary is satisfied",
  "preserved_invariants": [
    "feature branch does not select current work",
    "feature branch does not rewrite aggregate Planning indexes",
    "feature branch does not close parent/lane lifecycle truth",
    "integration apply is target-branch authoritative"
  ],
  "changed_fields": [
    "integration_proposal.status",
    "integration_proposal.phase",
    "owner.relationships.integration",
    "owner.revision",
    "owner.proof_report",
    "integration_receipt"
  ],
  "revisions": {
    "expected_subject": "df5fc39f297319d2",
    "subject_before": "df5fc39f297319d2",
    "subject_after": "fbc2c1db391cf22c",
    "proposal_before": "2116f144630d66a7",
    "proposal_after": "b71441652323a620",
    "expected_planning_revision": "ea77e8061988eee2",
    "target_authority_before": "6b37d6af9c593871",
    "target_authority_after": "680d25776adfc4bc"
  },
  "authority_boundary": {
    "integrated_truth": "this receipt",
    "proposal_status": "proposal marked integrated by the same batch transaction",
    "owner_body": "updated by this transaction",
    "aggregate_indexes": "derived-regenerated-not-mutated",
    "branch_admission": {
      "status": "inside-git",
      "branch": "master",
      "phase": "target"
    },
    "entrypoint": "planning reconcile --apply-pending-integrations"
  },
  "created_at": "2026-08-28T21:11:10.616243Z",
  "receipt_revision": "db9cc9070d956f1d"
}
