{
  "kind": "planning-integration-receipt/v1",
  "id": "p2-closed-lane-residue-archive-owner",
  "proposal_ref": ".agentic-workspace/planning/integration-proposals/p2-closed-lane-residue-archive-owner.integration-proposal.json",
  "outcome": "integrated",
  "requested_transition": "archive-owner",
  "owner": {
    "id": "p2-closed-lane-residue",
    "ref": ".agentic-workspace/planning/execplans/p2-closed-lane-residue.plan.json"
  },
  "external_ref": "",
  "proof_refs": [],
  "parent_boundary": "parent and lane remain open unless an independent boundary is satisfied",
  "preserved_invariants": [
    "feature branch does not select current work",
    "feature branch does not rewrite aggregate Planning indexes",
    "feature branch does not close parent/lane lifecycle truth",
    "integration apply is target-branch authoritative"
  ],
  "changed_fields": [
    "integration_proposal.status",
    "integration_proposal.phase",
    "owner.relationships.integration",
    "owner.lifecycle",
    "owner.phase",
    "owner.revision",
    "owner.active_milestone.status",
    "owner.proof_report",
    "integration_receipt"
  ],
  "revisions": {
    "expected_subject": "132c994dc1d9128a",
    "subject_before": "132c994dc1d9128a",
    "subject_after": "34188aa86bb75b34",
    "proposal_before": "b65f99b91d7269f6",
    "proposal_after": "411944d7b50f9c6c",
    "expected_planning_revision": "26ecea62cf403cd2",
    "target_authority_before": "26ecea62cf403cd2",
    "target_authority_after": "2ae144159ce4a724"
  },
  "authority_boundary": {
    "integrated_truth": "this receipt",
    "proposal_status": "proposal marked integrated by the same batch transaction",
    "owner_body": "updated by this transaction",
    "aggregate_indexes": "derived-regenerated-not-mutated",
    "branch_admission": {
      "status": "inside-git",
      "branch": "master",
      "phase": "target"
    },
    "entrypoint": "planning reconcile --apply-pending-integrations"
  },
  "created_at": "2026-08-29T08:49:11.222654Z",
  "receipt_revision": "ba15db3105ae1291"
}
