{
  "kind": "planning-integration-receipt/v1",
  "id": "pr-2838-archive-owner",
  "proposal_ref": ".agentic-workspace/planning/integration-proposals/pr-2838-archive-owner.integration-proposal.json",
  "outcome": "integrated",
  "requested_transition": "archive-owner",
  "owner": {
    "id": "issue-2805-codex-session-identity-bridge",
    "ref": ".agentic-workspace/planning/execplans/issue-2805-codex-session-identity-bridge.plan.json"
  },
  "external_ref": "PR #2838",
  "proof_refs": [
    "docs/reviews/codex-session-identity-canonical-invocation-2805.md",
    "55 focused launcher/agent-aid tests passed",
    "11 focused session capture tests passed",
    "503 Planning/workspace regression tests passed",
    "make check-planning-nosync passed",
    "workspace lint and cross-package typecheck passed",
    "validation runtime plan check passed",
    "structured file inventory check passed"
  ],
  "parent_boundary": "Issue #2805 is fully satisfied by this bounded lane; archive only after PR #2838 is merged on the target branch.",
  "preserved_invariants": [
    "provider identity remains outside portable AW core/package/generated contracts",
    "unavailable identity remains fail-honest",
    "the obsolete candidate aid remains deleted"
  ],
  "changed_fields": [
    "integration_proposal.status",
    "integration_proposal.phase",
    "owner.relationships.integration",
    "owner.lifecycle",
    "owner.phase",
    "owner.revision",
    "owner.active_milestone.status",
    "owner.proof_report",
    "integration_receipt"
  ],
  "revisions": {
    "expected_subject": "9460f50ec0aedf82",
    "subject_before": "9460f50ec0aedf82",
    "subject_after": "abf23d47d7e1f84d",
    "proposal_before": "fd2c0e5af3a26c74",
    "proposal_after": "088af6bb906a50e8",
    "expected_planning_revision": "49b921d5f552c114",
    "target_authority_before": "49b921d5f552c114",
    "target_authority_after": "3bd72a6e46edf94c"
  },
  "authority_boundary": {
    "integrated_truth": "this receipt",
    "proposal_status": "proposal marked integrated by the same batch transaction",
    "owner_body": "updated by this transaction",
    "aggregate_indexes": "derived-regenerated-not-mutated",
    "branch_admission": {
      "status": "inside-git",
      "branch": "master",
      "phase": "target"
    },
    "entrypoint": "planning reconcile --apply-pending-integrations"
  },
  "created_at": "2026-08-29T10:11:07.309854Z",
  "receipt_revision": "94e9908b96e5c0b0"
}
