{
  "kind": "planning-integration-receipt/v1",
  "id": "issue-2740-replay-archive-owner",
  "proposal_ref": ".agentic-workspace/planning/integration-proposals/issue-2740-replay-archive-owner.integration-proposal.json",
  "outcome": "integrated",
  "requested_transition": "archive-owner",
  "owner": {
    "id": "issue-2740-replay",
    "ref": ".agentic-workspace/planning/execplans/issue-2740-replay.plan.json"
  },
  "external_ref": "",
  "proof_refs": [],
  "parent_boundary": "parent and lane remain open unless an independent boundary is satisfied",
  "preserved_invariants": [
    "feature branch does not select current work",
    "feature branch does not rewrite aggregate Planning indexes",
    "feature branch does not close parent/lane lifecycle truth",
    "integration apply is target-branch authoritative"
  ],
  "changed_fields": [
    "integration_proposal.status",
    "integration_proposal.phase",
    "owner.relationships.integration",
    "owner.lifecycle",
    "owner.phase",
    "owner.revision",
    "owner.active_milestone.status",
    "owner.proof_report",
    "integration_receipt"
  ],
  "revisions": {
    "expected_subject": "71151d08da85ce20",
    "subject_before": "71151d08da85ce20",
    "subject_after": "9a3393608a58f9a0",
    "proposal_before": "3216a93e2d535d59",
    "proposal_after": "1f84c49eff65413b",
    "expected_planning_revision": "61196491496df0dd",
    "target_authority_before": "61196491496df0dd",
    "target_authority_after": "e966553c04e16095"
  },
  "authority_boundary": {
    "integrated_truth": "this receipt",
    "proposal_status": "proposal marked integrated by the same transaction",
    "owner_body": "updated by this transaction",
    "aggregate_indexes": "derived-regenerated-not-mutated",
    "branch_admission": {
      "status": "inside-git",
      "branch": "merge-queue/open-issues-review-repair",
      "phase": "target"
    }
  },
  "created_at": "2026-08-26T20:42:22.266666Z",
  "receipt_revision": "f240aea2def8bb63"
}
