{
  "kind": "planning-integration-receipt/v1",
  "id": "p0-promotion-protection-archive-owner",
  "proposal_ref": ".agentic-workspace/planning/integration-proposals/p0-promotion-protection-archive-owner.integration-proposal.json",
  "outcome": "integrated",
  "requested_transition": "archive-owner",
  "owner": {
    "id": "p0-promotion-protection",
    "ref": ".agentic-workspace/planning/execplans/p0-promotion-protection.plan.json"
  },
  "external_ref": "2454",
  "proof_refs": [
    "GitHub Actions run 31365468814",
    "uv run pytest tests/test_support_bearing_promotion.py tests/test_release_workflows.py -q"
  ],
  "parent_boundary": "GitHub issue #2448 remains open for the public protected-commit release rehearsal and remaining release-critical children",
  "preserved_invariants": [
    "feature branch does not select current work",
    "feature branch does not rewrite aggregate Planning indexes",
    "feature branch does not close parent/lane lifecycle truth",
    "integration apply is target-branch authoritative"
  ],
  "changed_fields": [
    "integration_proposal.status",
    "integration_proposal.phase",
    "owner.relationships.integration",
    "owner.lifecycle",
    "owner.phase",
    "owner.revision",
    "owner.active_milestone.status",
    "owner.proof_report",
    "integration_receipt"
  ],
  "revisions": {
    "expected_subject": "cb41c6d077809752",
    "subject_before": "cb41c6d077809752",
    "subject_after": "5770651a9c2c079c",
    "proposal_before": "32aa49272827230a",
    "proposal_after": "ebc00e53c326596f",
    "expected_planning_revision": "59d7e4b5a979493e",
    "target_authority_before": "6b37d6af9c593871",
    "target_authority_after": "680d25776adfc4bc"
  },
  "authority_boundary": {
    "integrated_truth": "this receipt",
    "proposal_status": "proposal marked integrated by the same batch transaction",
    "owner_body": "updated by this transaction",
    "aggregate_indexes": "derived-regenerated-not-mutated",
    "branch_admission": {
      "status": "inside-git",
      "branch": "master",
      "phase": "target"
    },
    "entrypoint": "planning reconcile --apply-pending-integrations"
  },
  "created_at": "2026-08-28T21:11:10.616243Z",
  "receipt_revision": "9f78b5eb94d6a72c"
}
