{
  "kind": "planning-integration-receipt/v1",
  "id": "issues-2680-2690-future-context-archive-owner",
  "proposal_ref": ".agentic-workspace/planning/integration-proposals/issues-2680-2690-future-context-archive-owner.integration-proposal.json",
  "outcome": "integrated",
  "requested_transition": "archive-owner",
  "owner": {
    "id": "issues-2680-2690-future-context",
    "ref": ".agentic-workspace/planning/execplans/issues-2680-2690-future-context.plan.json"
  },
  "external_ref": "PR#2694@070c15c3e",
  "proof_refs": [
    "tests/test_external_agent_evaluation_lane.py:688-passed",
    "live-evaluation:executed-head-543e45c4f-restack-equivalent-070c15c3e",
    "implementation-head:070c15c3e01f313a2e9bd6c2c619cb0c38b7978b",
    "generated-conformance:passed"
  ],
  "parent_boundary": "Archive the final slice after PR #2694 lands; close the aggregate lane only after both stack PRs and proposals are integrated.",
  "preserved_invariants": [
    "independent-host-authority",
    "no-parallel-context-workflow",
    "partial-compliance-fail-visible",
    "no-context-quiet",
    "ordered-stack-integration"
  ],
  "changed_fields": [
    "integration_proposal.status",
    "integration_proposal.phase",
    "owner.relationships.integration",
    "owner.lifecycle",
    "owner.phase",
    "owner.revision",
    "owner.active_milestone.status",
    "owner.proof_report",
    "integration_receipt"
  ],
  "revisions": {
    "expected_subject": "8e94d2ca706259a8",
    "subject_before": "8e94d2ca706259a8",
    "subject_after": "c5cbed374e59f2c3",
    "proposal_before": "1046cece6cb9fb2b",
    "proposal_after": "59738473fb738031",
    "expected_planning_revision": "a2911b20422fdcaa",
    "target_authority_before": "6b37d6af9c593871",
    "target_authority_after": "680d25776adfc4bc"
  },
  "authority_boundary": {
    "integrated_truth": "this receipt",
    "proposal_status": "proposal marked integrated by the same batch transaction",
    "owner_body": "updated by this transaction",
    "aggregate_indexes": "derived-regenerated-not-mutated",
    "branch_admission": {
      "status": "inside-git",
      "branch": "master",
      "phase": "target"
    },
    "entrypoint": "planning reconcile --apply-pending-integrations"
  },
  "created_at": "2026-08-28T21:11:10.616243Z",
  "receipt_revision": "4ff0f4cf9e733dde"
}
